### ISSUE TITLE
Media driver name resolution bootstrap failing to retry?

### ISSUE THREAD

**Issue by davidtwomey** [aeron-io/aeron#1951]
**Description:**
- We have three media driver nodes which are trying to use aeron driver naming and are intermittently getting problems with bootstrap.
- We are running the java aeron media driver with version `1.47.5`. All nodes are running identical code / versions.
- All media drivers are cycling as expected (_we can observe position counters incrementing on all three via aeronStat_)
- NOTE: we only see this on a fully re-deploy, but once it starts the problem is persistent. 

Current configuration is:
- `node0` has 3 valid bootstrap neighbours: 

```
  nameResolver=io.aeron.driver.DefaultNameResolver@3e1fd62b  
  resolverName='dev-platform.media-driver-0'
  resolverInterface='10.244.2.78:8050'
  resolverBootstrapNeighbor='10.244.2.78:8050,10.244.0.82:8050,10.244.1.85:8050'
```

```
 32:          436,515,727 - NameResolver max time in ns
 33:                    0 - NameResolver exceeded threshold count
 40:                    0 - Resolver neighbors: bound 10.244.2.78:8050 bootstrap 10.244.2.78:8050
 41:                    0 - Resolver cache entries: name=dev-platform.media-driver-0

```

- `node1` has both itself and `node2` as bootstrap neighbours

```
    nameResolver=io.aeron.driver.DefaultNameResolver@3e1fd62b
    resolverName='dev-platform.media-driver-1'
    resolverInterface='10.244.0.82:8050'
    resolverBootstrapNeighbor='10.244.2.70:8050,10.244.0.82:8050,10.244.1.85:8050'
```

```
 32:           39,345,868 - NameResolver max time in ns
 33:                    0 - NameResolver exceeded threshold count
 40:                    1 - Resolver neighbors: bound 10.244.0.82:8050 bootstrap 10.244.2.70:8050
 41:                    1 - Resolver cache entries: name=dev-platform.media-driver-1

```

- `node2` has only itself

```
    nameResolver=io.aeron.driver.DefaultNameResolver@3e1fd62b
    resolverName='dev-platform.media-driver-2'
    resolverInterface='10.244.1.85:8050'
    resolverBootstrapNeighbor='10.244.2.70:8050,10.244.0.74:8050,10.244.1.85:8050'

```

```
32:          185,997,667 - NameResolver max time in ns
 33:                    0 - NameResolver exceeded threshold count
 40:                    1 - Resolver neighbors: bound 10.244.1.85:8050 bootstrap 10.244.2.70:8050
 41:                    1 - Resolver cache entries: name=dev-platform.media-driver-2

```

This should, I believe, be a valid bootstrap configuration.

However, `node0` seems to be unable to bootstrap from the either of the correctly configured neighbours.

---
The only aeron errors we can see are name resolution failures:

```
87704 observations from 2026-03-03 16:08:02.078+0000 to 2026-03-03 18:36:45.430+0000 for:
io.aeron.driver.exceptions.InvalidChannelException: java.net.UnknownHostException: unresolved - endpoint=dev-platform.media-driver-2:9003, name-resolver=TimeTracking(io.aeron.driver.DriverNameResolver)
        at io.aeron.driver.media.UdpChannel.parse(UdpChannel.java:299)
        at io.aeron.driver.DriverConductor.lambda$onAddNetworkPublication$5(DriverConductor.java:543)
        at io.aeron.driver.DriverConductor$AsyncResult.of(DriverConductor.java:2895)
        at io.aeron.driver.DriverConductor.lambda$executeAsyncClientTask$18(DriverConductor.java:1639)
        at java.base/java.util.concurrent.ThreadPoolExecutor.runWorker(ThreadPoolExecutor.java:1144)
        at java.base/java.util.concurrent.ThreadPoolExecutor$Worker.run(ThreadPoolExecutor.java:642)
        at java.base/java.lang.Thread.run(Thread.java:1583)
Caused by: java.net.UnknownHostException: unresolved - endpoint=dev-platform.media-driver-2:9003, name-resolver=TimeTracking(io.aeron.driver.DriverNameResolver)
        at io.aeron.driver.media.UdpChannel.getEndpointAddress(UdpChannel.java:1036)
        at io.aeron.driver.media.UdpChannel.parse(UdpChannel.java:148)
        ... 6 more
```

---

Also note, we ran a tcp dump from two nodes with the following (see below). We have therefore validated that we never see any gossip traffic to or from `node0`, as this would show up as `10.244.2.78:8050` as source. 

We would expect period attempts to gossip (as it should do every ~10 seconds).

`node0`:
```
tcpdump -nn port 8050
tcpdump: verbose output suppressed, use -v[v]... for full protocol decode
listening on eth0, link-type EN10MB (Ethernet), snapshot length 262144 bytes
12:07:27.268090 IP 10.244.1.85.8050 > 10.244.2.70.8050: UDP, length 56
12:07:27.268141 IP 10.244.1.85.8050 > 10.244.2.70.8050: UDP, length 56
12:07:27.789028 IP 10.244.0.82.8050 > 10.244.2.70.8050: UDP, length 56
12:07:27.789086 IP 10.244.0.82.8050 > 10.244.2.70.8050: UDP, length 56
12:07:28.274878 IP 10.244.1.85.8050 > 10.244.2.70.8050: UDP, length 56
12:07:28.274932 IP 10.244.1.85.8050 > 10.244.2.70.8050: UDP, length 56
12:07:28.798898 IP 10.244.0.82.8050 > 10.244.2.70.8050: UDP, length 56
12:07:28.798950 IP 10.244.0.82.8050 > 10.244.2.70.8050: UDP, length 56
12:07:29.277933 IP 10.244.1.85.8050 > 10.244.2.70.8050: UDP, length 56
12:07:29.277982 IP 10.244.1.85.8050 > 10.244.2.70.8050: UDP, length 56
12:07:29.808337 IP 10.244.0.82.8050 > 10.244.2.70.8050: UDP, length 56
12:07:29.808388 IP 10.244.0.82.8050 > 10.244.2.70.8050: UDP, length 56
12:07:30.280253 IP 10.244.1.85.8050 > 10.244.2.70.8050: UDP, length 56
12:07:30.280297 IP 10.244.1.85.8050 > 10.244.2.70.8050: UDP, length 56
```

`node1`:

```
tcpdump -nn port 8050
tcpdump: verbose output suppressed, use -v[v]... for full protocol decode
listening on eth0, link-type EN10MB (Ethernet), snapshot length 262144 bytes
12:07:15.135358 IP 10.244.0.82.8050 > 10.244.1.85.8050: UDP, length 56
12:07:15.202074 IP 10.244.1.85.8050 > 10.244.0.82.8050: UDP, length 56
12:07:15.257403 IP 10.244.1.85.8050 > 10.244.0.82.8050: UDP, length 56
12:07:15.681667 IP 10.244.0.82.8050 > 10.244.1.85.8050: UDP, length 56
12:07:15.681692 IP 10.244.0.82.8050 > 10.244.2.70.8050: UDP, length 56
12:07:16.208129 IP 10.244.1.85.8050 > 10.244.0.82.8050: UDP, length 56
12:07:16.692971 IP 10.244.0.82.8050 > 10.244.1.85.8050: UDP, length 56
12:07:16.692993 IP 10.244.0.82.8050 > 10.244.2.70.8050: UDP, length 56
12:07:17.141802 IP 10.244.0.82.8050 > 10.244.1.85.8050: UDP, length 56
12:07:17.215274 IP 10.244.1.85.8050 > 10.244.0.82.8050: UDP, length 56
12:07:17.261969 IP 10.244.1.85.8050 > 10.244.0.82.8050: UDP, length 56
12:07:17.698682 IP 10.244.0.82.8050 > 10.244.1.85.8050: UDP, length 56
12:07:17.698726 IP 10.244.0.82.8050 > 10.244.2.70.8050: UDP, length 56
12:07:18.219028 IP 10.244.1.85.8050 > 10.244.0.82.8050: UDP, length 56
12:07:18.711102 IP 10.244.0.82.8050 > 10.244.1.85.8050: UDP, length 56
12:07:18.711124 IP 10.244.0.82.8050 > 10.244.2.70.8050: UDP, length 56
12:07:19.146865 IP 10.244.0.82.8050 > 10.244.1.85.8050: UDP, length 56
12:07:19.219383 IP 10.244.1.85.8050 > 10.244.0.82.8050: UDP, length 56
12:07:19.266708 IP 10.244.1.85.8050 > 10.244.0.82.8050: UDP, length 56
```

**Comment by vyazelenko** [comment]
@davidtwomey Your actual bootstrap config looks like this:

<img width="1059" height="579" alt="Image" src="https://github.com/user-attachments/assets/3491dd29-aa1b-4775-a05d-4fda006bc339" />

The numbers signify order in the bootstrap neighbors list. Bootstrap neighbors connections are attempted in that order and the first one to connected will be used. Hence:
* `node0` -> connects to itself
* `node1` -> connects to `nodeX`
* `node2` -> connects to `nodeX`

Once connected the bootstrap neighbor remains unchanged unless the node goes away, i.e. we haven't heard anything from that node for at least 10 seconds. After the expiration the re-connection to the bootstrap list will be attempted again.

The main issue is that the node itself will never go away and as such `node0` will never connect to other nodes. The solution is to remove self addresses from the bootstrap list. 

I think Aeron should either validate that the self address is not specified in the list or simply skip the bootstrap neighbor if it points to self.

**Comment by davidtwomey** [comment]
thanks @vyazelenko - i will update on our side to fix the issue. This would be good to add to the documentation as I feel like this could be a common gotcha (the part about **ordering** of the bootstrap neightbours)

**Comment by vyazelenko** [comment]
@davidtwomey I've documented this issue in the [Driver Names and Name Resolver](https://github.com/aeron-io/aeron/wiki/Name-Resolution#driver-names-and-name-resolver) wiki page.

We are also considering fixing this in the name resolver, i.e. connecting to all configured bootstrap neighbors instead of choosing one.

**Comment by davidtwomey** [comment]
Thanks @vyazelenko !
